{
  "id": "2025-09-16-file-operations-reliability",
  "title": "Improve File Operations Reliability and Validation",
  "owner": "AI Agent",
  "status": "planned",
  "created_at": "2025-09-16 14:41",
  "updated_at": "2025-09-16 14:41",
  "progress_percent": 0,
  "tags": ["file-operations", "reliability", "validation", "editor-tool"],
  "summary": "Enhance file operation reliability and add validation to ensure consistent file creation and modification",
  "success_criteria": [
    {"text": "File creation operations are reliable", "checked": false},
    {"text": "File modification operations work consistently", "checked": false},
    {"text": "File validation is implemented", "checked": false},
    {"text": "Error handling for file operations is improved", "checked": false},
    {"text": "File operation success is verifiable", "checked": false}
  ],
  "acceptance_checks": [
    {"text": "Files are created when requested", "checked": false},
    {"text": "Files are modified correctly", "checked": false},
    {"text": "File operations return success/failure status", "checked": false},
    {"text": "Error messages are descriptive", "checked": false},
    {"text": "File existence is validated after operations", "checked": false}
  ],
  "subtasks": [
    "Examine EditorTool implementation",
    "Add file operation validation",
    "Improve error handling",
    "Add retry mechanisms",
    "Implement success verification",
    "Test with various file types",
    "Update error messages"
  ],
  "todo": [
    {"text": "Examine EditorTool implementation", "status": "not-started", "date_started": null, "date_stopped": null},
    {"text": "Add file operation validation", "status": "not-started", "date_started": null, "date_stopped": null},
    {"text": "Improve error handling", "status": "not-started", "date_started": null, "date_stopped": null},
    {"text": "Add retry mechanisms", "status": "not-started", "date_started": null, "date_stopped": null},
    {"text": "Implement success verification", "status": "not-started", "date_started": null, "date_stopped": null},
    {"text": "Test with various file types", "status": "not-started", "date_started": null, "date_stopped": null},
    {"text": "Update error messages", "status": "not-started", "date_started": null, "date_stopped": null}
  ],
  "changelog": [
    {"timestamp": "2025-09-16 14:41", "text": "File operations reliability task created"}
  ],
  "decisions": [],
  "lessons_learned": [],
  "issues_risks": [
    "File creation operations sometimes fail silently",
    "No validation of file operation success",
    "Poor error handling for file operations",
    "No retry mechanisms for failed operations"
  ],
  "next_steps": [
    "Examine src/cage/editor_tool.py implementation",
    "Add file existence validation after operations",
    "Implement retry mechanisms for failed operations",
    "Improve error messages and logging"
  ],
  "references": [],
  "locks": [],
  "migration": {"migrated": false, "source_path": null, "method": null, "migrated_at": null},
  "metadata": {
    "priority": "high",
    "component": "editor_tool",
    "files_to_examine": [
      "src/cage/editor_tool.py",
      "src/api/main.py"
    ],
    "test_scenarios": [
      "Create new file",
      "Modify existing file",
      "Delete file",
      "Create multiple files",
      "Handle file operation failures"
    ]
  },
  "prompts": []
}
